number,value,datetime_start,datetime_complete,duration,params_C,params_aux_max_features,params_aux_min_df,params_aux_ngram_high,params_calibration_method,params_readme_max_features,params_readme_min_df,params_readme_ngram_high,user_attrs_f1,user_attrs_precision,user_attrs_recall,user_attrs_threshold,state
0,0.7272727272727273,2026-04-14 11:57:24.110875,2026-04-14 11:57:34.409715,0 days 00:00:10.298840,3.8965578025091947,150,2,2,isotonic,400,3,2,0.7272727272727273,0.96,0.5853658536585366,0.960410067,COMPLETE
1,0.7272727272727273,2026-04-14 11:57:34.409936,2026-04-14 11:57:41.138180,0 days 00:00:06.728244,1.1333598428053422,300,3,2,sigmoid,400,2,1,0.7272727272727273,0.96,0.5853658536585366,0.9456384213,COMPLETE
2,0.7272727272727273,2026-04-14 11:57:41.138379,2026-04-14 11:57:46.406721,0 days 00:00:05.268342,0.6028804742508801,100,2,2,isotonic,200,3,2,0.7272727272727273,0.96,0.5853658536585366,0.9603910886,COMPLETE
3,0.7272727272727273,2026-04-14 11:57:46.406933,2026-04-14 11:57:52.704684,0 days 00:00:06.297751,0.0043671688536429925,150,3,2,sigmoid,300,2,1,0.7272727272727273,0.96,0.5853658536585366,0.9648980848,COMPLETE
4,0.7164179104477612,2026-04-14 11:57:52.704891,2026-04-14 11:58:00.083449,0 days 00:00:07.378558,2.900034247901351,300,3,2,isotonic,200,4,1,0.7164179104477612,0.9230769230769231,0.5853658536585366,0.8976129395,COMPLETE
5,0.7164179104477612,2026-04-14 11:58:00.083662,2026-04-14 11:58:01.987036,0 days 00:00:01.903374,1.1342883589326203,150,1,1,isotonic,800,2,1,0.7164179104477612,0.9230769230769231,0.5853658536585366,0.9571592313,COMPLETE
6,0.7384615384615385,2026-04-14 11:58:01.987220,2026-04-14 11:58:06.349700,0 days 00:00:04.362480,17.117295635659133,100,2,1,isotonic,300,2,1,0.7384615384615385,1.0,0.5853658536585366,0.9592694064,COMPLETE
7,0.7164179104477612,2026-04-14 11:58:06.349908,2026-04-14 11:58:10.858466,0 days 00:00:04.508558,0.27752954184734613,50,3,2,isotonic,300,5,2,0.7164179104477612,0.9230769230769231,0.5853658536585366,0.961025641,COMPLETE
8,0.782608695652174,2026-04-14 11:58:10.858686,2026-04-14 11:58:14.363401,0 days 00:00:03.504715,0.001452325850334455,300,3,2,isotonic,600,4,2,0.782608695652174,0.9642857142857143,0.6585365853658537,0.7699604743,COMPLETE
9,0.746268656716418,2026-04-14 11:58:14.363625,2026-04-14 11:58:15.707734,0 days 00:00:01.344109,0.0029398164211325408,300,1,1,isotonic,200,2,1,0.746268656716418,0.9615384615384616,0.6097560975609756,0.8852755194,COMPLETE
10,0.7272727272727273,2026-04-14 11:58:15.708015,2026-04-14 11:58:24.107595,0 days 00:00:08.399580,0.024870105371383122,250,2,1,sigmoid,700,5,2,0.7272727272727273,0.96,0.5853658536585366,0.9857426122,COMPLETE
11,0.7647058823529411,2026-04-14 11:58:24.107788,2026-04-14 11:58:27.782040,0 days 00:00:03.674252,0.0010444959583145222,250,1,1,isotonic,600,4,2,0.7647058823529411,0.9629629629629629,0.6341463414634146,0.8445503467,COMPLETE
12,0.7536231884057971,2026-04-14 11:58:27.782274,2026-04-14 11:58:31.378438,0 days 00:00:03.596164,0.0010097550079988373,250,1,1,isotonic,600,4,2,0.7536231884057971,0.9285714285714286,0.6341463414634146,0.8269978762,COMPLETE
13,0.7058823529411765,2026-04-14 11:58:31.378642,2026-04-14 11:58:34.940034,0 days 00:00:03.561392,0.037749191148262126,250,1,1,isotonic,600,4,2,0.7058823529411765,0.8888888888888888,0.5853658536585366,0.961025641,COMPLETE
14,0.7058823529411765,2026-04-14 11:58:34.940235,2026-04-14 11:58:43.649179,0 days 00:00:08.708944,0.012099621155066458,200,2,1,sigmoid,600,4,2,0.7058823529411765,0.8888888888888888,0.5853658536585366,0.9336073127,COMPLETE
15,0.7714285714285715,2026-04-14 11:58:43.649381,2026-04-14 11:58:47.292526,0 days 00:00:03.643145,0.0010791495218413767,200,1,2,isotonic,500,5,2,0.7714285714285715,0.9310344827586207,0.6585365853658537,0.7799748774,COMPLETE
16,0.7164179104477612,2026-04-14 11:58:47.292730,2026-04-14 11:58:51.035945,0 days 00:00:03.743215,0.07757144402236037,200,3,2,isotonic,500,5,2,0.7164179104477612,0.9230769230769231,0.5853658536585366,0.961025641,COMPLETE
17,0.7272727272727273,2026-04-14 11:58:51.036162,2026-04-14 11:58:54.937396,0 days 00:00:03.901234,0.0073574011810904165,200,2,2,isotonic,500,5,2,0.7272727272727273,0.96,0.5853658536585366,0.9592200841,COMPLETE
18,0.7272727272727273,2026-04-14 11:58:54.937620,2026-04-14 11:59:04.669285,0 days 00:00:09.731665,0.0036753168863403207,300,1,2,sigmoid,800,3,2,0.7272727272727273,0.96,0.5853658536585366,0.845010206,COMPLETE
19,0.7164179104477612,2026-04-14 11:59:04.669488,2026-04-14 11:59:08.419551,0 days 00:00:03.750063,0.017422567713626134,50,3,2,isotonic,700,5,2,0.7164179104477612,0.9230769230769231,0.5853658536585366,0.96582365,COMPLETE
20,0.7714285714285715,2026-04-14 11:59:08.419736,2026-04-14 11:59:12.124638,0 days 00:00:03.704902,0.0016164996193996398,100,2,2,isotonic,400,5,2,0.7714285714285715,0.9310344827586207,0.6585365853658537,0.7791353383,COMPLETE
21,0.7714285714285715,2026-04-14 11:59:12.124830,2026-04-14 11:59:15.766357,0 days 00:00:03.641527,0.001864456756514352,100,2,2,isotonic,400,5,2,0.7714285714285715,0.9310344827586207,0.6585365853658537,0.7645417075,COMPLETE
22,0.7272727272727273,2026-04-14 11:59:15.766564,2026-04-14 11:59:19.382900,0 days 00:00:03.616336,0.007486735513160898,100,1,2,isotonic,500,5,2,0.7272727272727273,0.96,0.5853658536585366,0.9592200841,COMPLETE
23,0.7536231884057971,2026-04-14 11:59:19.383111,2026-04-14 11:59:22.941372,0 days 00:00:03.558261,0.0021683548361467074,200,2,2,isotonic,400,4,2,0.7536231884057971,0.9285714285714286,0.6341463414634146,0.8137618915,COMPLETE
24,0.7164179104477612,2026-04-14 11:59:22.941562,2026-04-14 11:59:26.697478,0 days 00:00:03.755916,0.05694687015049109,50,3,2,isotonic,700,5,2,0.7164179104477612,0.9230769230769231,0.5853658536585366,0.961025641,COMPLETE
25,0.7272727272727273,2026-04-14 11:59:26.697696,2026-04-14 11:59:30.243643,0 days 00:00:03.545947,0.005981558841359909,150,2,2,isotonic,500,4,2,0.7272727272727273,0.96,0.5853658536585366,0.9592200841,COMPLETE
26,0.7352941176470589,2026-04-14 11:59:30.243829,2026-04-14 11:59:39.223091,0 days 00:00:08.979262,0.0010549577710057619,250,2,2,sigmoid,600,5,2,0.7352941176470589,0.9259259259259259,0.6097560975609756,0.7309972654,COMPLETE
27,0.7164179104477612,2026-04-14 11:59:39.223381,2026-04-14 11:59:43.442602,0 days 00:00:04.219221,0.14919220642353037,100,1,2,isotonic,400,3,2,0.7164179104477612,0.9230769230769231,0.5853658536585366,0.961025641,COMPLETE
28,0.7647058823529411,2026-04-14 11:59:43.442795,2026-04-14 11:59:47.206649,0 days 00:00:03.763854,0.0021928075144871284,200,3,2,isotonic,500,4,2,0.7647058823529411,0.9629629629629629,0.6341463414634146,0.8632019854,COMPLETE
29,0.7058823529411765,2026-04-14 11:59:47.206930,2026-04-14 11:59:50.817102,0 days 00:00:03.610172,0.013805710106549882,150,2,2,isotonic,300,3,2,0.7058823529411765,0.8888888888888888,0.5853658536585366,0.9530664979,COMPLETE
30,0.7536231884057971,2026-04-14 11:59:50.817297,2026-04-14 11:59:54.457284,0 days 00:00:03.639987,0.002231355044868178,150,2,2,isotonic,500,5,2,0.7536231884057971,0.9285714285714286,0.6341463414634146,0.8375937865,COMPLETE
31,0.7714285714285715,2026-04-14 11:59:54.457542,2026-04-14 11:59:57.979812,0 days 00:00:03.522270,0.001688121453615929,100,2,2,isotonic,400,5,2,0.7714285714285715,0.9310344827586207,0.6585365853658537,0.7700773673,COMPLETE
32,0.7352941176470589,2026-04-14 11:59:57.980077,2026-04-14 12:00:01.754408,0 days 00:00:03.774331,0.0034269934596180053,50,2,2,isotonic,400,5,2,0.7352941176470589,0.9259259259259259,0.6097560975609756,0.8599298599,COMPLETE
33,0.7272727272727273,2026-04-14 12:00:01.754618,2026-04-14 12:00:05.778940,0 days 00:00:04.024322,0.009745991420243868,100,2,2,isotonic,500,5,2,0.7272727272727273,0.96,0.5853658536585366,0.9592200841,COMPLETE
34,0.7272727272727273,2026-04-14 12:00:05.779132,2026-04-14 12:00:15.319043,0 days 00:00:09.539911,0.0017192267065337756,100,3,2,sigmoid,300,5,2,0.7272727272727273,0.96,0.5853658536585366,0.7613453297,COMPLETE
35,0.7272727272727273,2026-04-14 12:00:15.319371,2026-04-14 12:00:17.240398,0 days 00:00:01.921027,0.005195133859772485,300,2,2,isotonic,400,4,1,0.7272727272727273,0.96,0.5853658536585366,0.9592200841,COMPLETE
36,0.782608695652174,2026-04-14 12:00:17.240599,2026-04-14 12:00:21.175757,0 days 00:00:03.935158,0.0015081355360079688,150,3,2,isotonic,400,5,2,0.782608695652174,0.9642857142857143,0.6585365853658537,0.8313807155,COMPLETE
37,0.7352941176470589,2026-04-14 12:00:21.175957,2026-04-14 12:00:22.720323,0 days 00:00:01.544366,0.00408270994688512,150,3,2,isotonic,400,4,1,0.7352941176470589,0.9259259259259259,0.6097560975609756,0.7850862154,COMPLETE
38,0.7272727272727273,2026-04-14 12:00:22.720676,2026-04-14 12:00:32.396979,0 days 00:00:09.676303,3.306993136889143,150,3,2,sigmoid,600,5,2,0.7272727272727273,0.96,0.5853658536585366,0.9928578905,COMPLETE
39,0.7272727272727273,2026-04-14 12:00:32.397192,2026-04-14 12:00:37.310537,0 days 00:00:04.913345,0.9735204086770421,200,3,2,isotonic,300,4,1,0.7272727272727273,0.96,0.5853658536585366,0.9604366826,COMPLETE
40,0.7714285714285715,2026-04-14 12:00:37.310742,2026-04-14 12:00:41.408269,0 days 00:00:04.097527,0.0014064553260269533,300,3,2,isotonic,700,3,2,0.7714285714285715,0.9310344827586207,0.6585365853658537,0.7407985074,COMPLETE
41,0.7536231884057971,2026-04-14 12:00:41.408462,2026-04-14 12:00:45.478979,0 days 00:00:04.070517,0.0033055368222357703,100,3,2,isotonic,400,5,2,0.7536231884057971,0.9285714285714286,0.6341463414634146,0.7433663315,COMPLETE
42,0.782608695652174,2026-04-14 12:00:45.479322,2026-04-14 12:00:49.517243,0 days 00:00:04.037921,0.0014473872824798742,100,3,2,isotonic,400,5,2,0.782608695652174,0.9642857142857143,0.6585365853658537,0.7652464495,COMPLETE
43,0.7647058823529411,2026-04-14 12:00:49.517445,2026-04-14 12:00:53.558037,0 days 00:00:04.040592,0.0010184432776619466,150,3,2,isotonic,300,5,2,0.7647058823529411,0.9629629629629629,0.6341463414634146,0.8535368319,COMPLETE
44,0.7647058823529411,2026-04-14 12:00:53.558232,2026-04-14 12:00:57.669566,0 days 00:00:04.111334,0.0027534178948714237,50,3,2,isotonic,200,5,2,0.7647058823529411,0.9629629629629629,0.6341463414634146,0.8750559546,COMPLETE
45,0.7272727272727273,2026-04-14 12:00:57.669770,2026-04-14 12:01:08.145056,0 days 00:00:10.475286,8.368287513382128,100,3,2,isotonic,500,5,2,0.7272727272727273,0.96,0.5853658536585366,0.956314004,COMPLETE
46,0.7164179104477612,2026-04-14 12:01:08.145248,2026-04-14 12:01:11.928399,0 days 00:00:03.783151,0.026515651216471745,250,3,2,isotonic,500,5,2,0.7164179104477612,0.9230769230769231,0.5853658536585366,0.9654350817,COMPLETE
47,0.7272727272727273,2026-04-14 12:01:11.928615,2026-04-14 12:01:15.599147,0 days 00:00:03.670532,0.005130200392535257,100,1,2,isotonic,400,4,2,0.7272727272727273,0.96,0.5853658536585366,0.9592200841,COMPLETE
48,0.7272727272727273,2026-04-14 12:01:15.599349,2026-04-14 12:01:25.308166,0 days 00:00:09.708817,0.3023886080722491,150,3,1,sigmoid,600,5,2,0.7272727272727273,0.96,0.5853658536585366,0.9916726898,COMPLETE
49,0.782608695652174,2026-04-14 12:01:25.308428,2026-04-14 12:01:26.943921,0 days 00:00:01.635493,0.0014137744308099628,150,1,2,isotonic,300,2,1,0.782608695652174,0.9642857142857143,0.6585365853658537,0.7622434465,COMPLETE
50,0.7714285714285715,2026-04-14 12:01:26.944124,2026-04-14 12:01:28.427193,0 days 00:00:01.483069,0.0013223436384387722,200,1,2,isotonic,200,2,1,0.7714285714285715,0.9310344827586207,0.6585365853658537,0.784594882,COMPLETE
51,0.782608695652174,2026-04-14 12:01:28.427382,2026-04-14 12:01:29.888624,0 days 00:00:01.461242,0.0015875613980932107,150,1,2,isotonic,300,2,1,0.782608695652174,0.9642857142857143,0.6585365853658537,0.8345932582,COMPLETE
52,0.7428571428571429,2026-04-14 12:01:29.888829,2026-04-14 12:01:31.519575,0 days 00:00:01.630746,0.002734374073402891,150,1,2,isotonic,300,2,1,0.7428571428571429,0.896551724137931,0.6341463414634146,0.7899489527,COMPLETE
53,0.7605633802816901,2026-04-14 12:01:31.519902,2026-04-14 12:01:33.108410,0 days 00:00:01.588508,0.0013558943375401376,150,1,2,isotonic,200,2,1,0.7605633802816901,0.9,0.6585365853658537,0.7618548781,COMPLETE
54,0.7272727272727273,2026-04-14 12:01:33.108596,2026-04-14 12:01:34.697890,0 days 00:00:01.589294,0.009403177827358635,200,1,2,isotonic,300,2,1,0.7272727272727273,0.96,0.5853658536585366,0.9592200841,COMPLETE
55,0.7352941176470589,2026-04-14 12:01:34.698181,2026-04-14 12:01:36.398924,0 days 00:00:01.700743,0.00419170851343396,150,1,2,isotonic,300,2,1,0.7352941176470589,0.9259259259259259,0.6097560975609756,0.8180354267,COMPLETE
56,0.7536231884057971,2026-04-14 12:01:36.399126,2026-04-14 12:01:38.120062,0 days 00:00:01.720936,0.0024697741518237555,250,1,2,isotonic,200,3,1,0.7536231884057971,0.9285714285714286,0.6341463414634146,0.8607547726,COMPLETE
57,0.7714285714285715,2026-04-14 12:01:38.120309,2026-04-14 12:01:39.628565,0 days 00:00:01.508256,0.001066894789442748,200,1,1,isotonic,300,2,1,0.7714285714285715,0.9310344827586207,0.6585365853658537,0.7799748774,COMPLETE
58,0.7272727272727273,2026-04-14 12:01:39.628761,2026-04-14 12:01:46.319440,0 days 00:00:06.690679,0.001937512705217695,150,1,2,sigmoid,600,3,1,0.7272727272727273,0.96,0.5853658536585366,0.7689249453,COMPLETE
59,0.7272727272727273,2026-04-14 12:01:46.319634,2026-04-14 12:01:47.848119,0 days 00:00:01.528485,0.007705050063438792,300,1,2,isotonic,500,2,1,0.7272727272727273,0.96,0.5853658536585366,0.9592200841,COMPLETE
60,0.7536231884057971,2026-04-14 12:01:47.848374,2026-04-14 12:01:49.367099,0 days 00:00:01.518725,0.0032279055486269127,200,1,2,isotonic,400,3,1,0.7536231884057971,0.9285714285714286,0.6341463414634146,0.7703468809,COMPLETE
61,0.782608695652174,2026-04-14 12:01:49.367304,2026-04-14 12:01:53.612720,0 days 00:00:04.245416,0.0015284781076989528,100,3,2,isotonic,400,5,2,0.782608695652174,0.9642857142857143,0.6585365853658537,0.8490070375,COMPLETE
62,0.782608695652174,2026-04-14 12:01:53.613098,2026-04-14 12:01:57.628773,0 days 00:00:04.015675,0.0014392840145088562,100,3,2,isotonic,400,5,2,0.782608695652174,0.9642857142857143,0.6585365853658537,0.7652464495,COMPLETE
63,0.782608695652174,2026-04-14 12:01:57.629006,2026-04-14 12:02:01.535449,0 days 00:00:03.906443,0.0015025598481766002,100,3,2,isotonic,400,5,2,0.782608695652174,0.9642857142857143,0.6585365853658537,0.7652464495,COMPLETE
64,0.7647058823529411,2026-04-14 12:02:01.535641,2026-04-14 12:02:05.178712,0 days 00:00:03.643071,0.0021599244676480146,50,3,2,isotonic,400,4,2,0.7647058823529411,0.9629629629629629,0.6341463414634146,0.8981230553,COMPLETE
65,0.7272727272727273,2026-04-14 12:02:05.178901,2026-04-14 12:02:14.093358,0 days 00:00:08.914457,2.005919429789409,100,3,2,isotonic,300,2,2,0.7272727272727273,0.96,0.5853658536585366,0.9605352284,COMPLETE
66,0.7272727272727273,2026-04-14 12:02:14.093584,2026-04-14 12:02:18.549257,0 days 00:00:04.455673,0.0061070983494906205,150,3,2,isotonic,400,5,2,0.7272727272727273,0.96,0.5853658536585366,0.9592200841,COMPLETE
67,0.7714285714285715,2026-04-14 12:02:18.549468,2026-04-14 12:02:22.285485,0 days 00:00:03.736017,0.0014292921569623721,100,3,2,isotonic,300,4,2,0.7714285714285715,0.9310344827586207,0.6585365853658537,0.7648578811,COMPLETE
68,0.7536231884057971,2026-04-14 12:02:22.285690,2026-04-14 12:02:26.150824,0 days 00:00:03.865134,0.002932732227330076,50,3,2,isotonic,400,5,2,0.7536231884057971,0.9285714285714286,0.6341463414634146,0.8599298599,COMPLETE
69,0.7272727272727273,2026-04-14 12:02:26.151140,2026-04-14 12:02:27.625968,0 days 00:00:01.474828,0.004584763721000046,100,3,2,isotonic,300,5,1,0.7272727272727273,0.96,0.5853658536585366,0.9592200841,COMPLETE
70,0.7164179104477612,2026-04-14 12:02:27.626211,2026-04-14 12:02:36.285672,0 days 00:00:08.659461,0.0019805683447977097,150,3,2,sigmoid,400,2,2,0.7164179104477612,0.9230769230769231,0.5853658536585366,0.7848177966,COMPLETE
71,0.782608695652174,2026-04-14 12:02:36.285897,2026-04-14 12:02:40.063880,0 days 00:00:03.777983,0.0014179585995699,100,3,2,isotonic,400,5,2,0.782608695652174,0.9642857142857143,0.6585365853658537,0.8177242813,COMPLETE
72,0.782608695652174,2026-04-14 12:02:40.064097,2026-04-14 12:02:43.905815,0 days 00:00:03.841718,0.0016742471708360493,100,3,2,isotonic,400,5,2,0.782608695652174,0.9642857142857143,0.6585365853658537,0.7652464495,COMPLETE
73,0.782608695652174,2026-04-14 12:02:43.906045,2026-04-14 12:02:47.816581,0 days 00:00:03.910536,0.001043730870969049,100,3,2,isotonic,400,5,2,0.782608695652174,0.9642857142857143,0.6585365853658537,0.8288361244,COMPLETE
74,0.7647058823529411,2026-04-14 12:02:47.816810,2026-04-14 12:02:51.376697,0 days 00:00:03.559887,0.0026162031172107525,100,3,2,isotonic,500,5,2,0.7647058823529411,0.9629629629629629,0.6341463414634146,0.8800614747,COMPLETE
75,0.7714285714285715,2026-04-14 12:02:51.376951,2026-04-14 12:02:55.151443,0 days 00:00:03.774492,0.0012857811786024308,150,3,2,isotonic,300,5,2,0.7714285714285715,0.9310344827586207,0.6585365853658537,0.7823288092,COMPLETE
76,0.7647058823529411,2026-04-14 12:02:55.151643,2026-04-14 12:02:59.303641,0 days 00:00:04.151998,0.001958902977356458,50,3,2,isotonic,400,5,2,0.7647058823529411,0.9629629629629629,0.6341463414634146,0.8981230553,COMPLETE
77,0.7352941176470589,2026-04-14 12:02:59.303849,2026-04-14 12:03:03.819574,0 days 00:00:04.515725,0.003929041107938223,100,3,2,isotonic,400,5,2,0.7352941176470589,0.9259259259259259,0.6097560975609756,0.7893391351,COMPLETE
78,0.782608695652174,2026-04-14 12:03:03.819919,2026-04-14 12:03:08.389091,0 days 00:00:04.569172,0.001683103406205935,150,3,2,isotonic,800,4,2,0.782608695652174,0.9642857142857143,0.6585365853658537,0.7406107858,COMPLETE
79,0.7647058823529411,2026-04-14 12:03:08.389299,2026-04-14 12:03:12.703660,0 days 00:00:04.314361,0.0024636828662889846,100,3,2,isotonic,300,5,2,0.7647058823529411,0.9629629629629629,0.6341463414634146,0.8894594209,COMPLETE
